{
  "id": "calico-flow-1777536345-8",
  "timestamp": "2026-01-01T00:00:00Z",
  "source": "network",
  "pod": {
    "name": "client",
    "namespace": "spike-traffic",
    "uid": ""
  },
  "category": "flow",
  "summary": "spike-traffic/client -\u003e spike-traffic/target:80 (tcp, allow, src)",
  "raw": {
    "flow": {
      "Key": {
        "action": "Allow",
        "dest_name": "target",
        "dest_namespace": "spike-traffic",
        "dest_port": "80",
        "dest_service_name": "target",
        "dest_service_namespace": "spike-traffic",
        "dest_service_port": "80",
        "dest_service_port_name": "-",
        "dest_type": "WorkloadEndpoint",
        "policies": {
          "enforced_policies": [
            {
              "action": "Allow",
              "kind": "Profile",
              "name": "kns.spike-traffic"
            }
          ],
          "pending_policies": [
            {
              "action": "Allow",
              "kind": "Profile",
              "name": "kns.spike-traffic"
            }
          ]
        },
        "proto": "tcp",
        "reporter": "Src",
        "source_name": "client",
        "source_namespace": "spike-traffic",
        "source_type": "WorkloadEndpoint"
      },
      "bytes_in": "17208",
      "bytes_out": "6722",
      "dest_labels": [
        "app=target"
      ],
      "end_time": "1777536360",
      "num_connections_completed": "15",
      "num_connections_live": "15",
      "num_connections_started": "15",
      "packets_in": "84",
      "packets_out": "101",
      "source_labels": [
        "app=client"
      ],
      "start_time": "1777536345"
    },
    "id": "8"
  },
  "tags": [
    "proto:tcp",
    "action:allow",
    "reporter:src",
    "src-type:workload",
    "dst-type:workload",
    "dst-port:80",
    "svc:spike-traffic/target",
    "conns-started:15"
  ]
}
